"Title","Metin 1","Metin 2","Görüntü 1","Metin 3","ID","Created Date","Updated Date","Owner","Dental Treatment Details Kopyası","Dental Detail "
"BBL Detail","Brazilian Butt Lift (BBL)","A Brazilian Butt Lift (BBL) is a cosmetic procedure that enhances the shape and volume of the buttocks by transferring fat from other areas of the body, such as the abdomen or thighs. The process involves liposuction to remove excess fat, which is then purified and re-injected into the buttocks to create a fuller, more natural-looking shape. The surgery is performed under general anesthesia, with minimal scarring. Recovery typically takes a few weeks, and results are long-lasting with proper aftercare. BBL provides a more defined, youthful, and proportional appearance.","wix:image://v1/e9f8ad_28db661d1ec04edba272d8a875a48506~mv2.jpg/12.jpg#originWidth=1080&originHeight=1080","Transform Your Silhouette with a Brazilian Butt Lift at Aesthetic Care Istanbul

The Brazilian Butt Lift (BBL) is a highly sought-after cosmetic procedure designed to enhance the size, shape, and contour of the buttocks using your body’s natural fat. At Aesthetic Care Istanbul, we specialize in delivering exceptional BBL results, combining advanced techniques with world-class care to provide a more sculpted, curvier silhouette.

What is a Brazilian Butt Lift (BBL)?
BBL is a dual-benefit procedure that involves liposuction to remove excess fat from areas such as the abdomen, thighs, or flanks, and fat transfer to the buttocks to create a fuller, more lifted appearance. Unlike implants, BBL uses your body’s natural fat, resulting in a more natural look and feel while reducing unwanted fat in other areas.

The Brazilian Butt Lift Process at Aesthetic Care Istanbul
At Aesthetic Care Istanbul, your journey begins with a personalized consultation to assess your goals and develop a customized treatment plan. Our expert surgeons use cutting-edge techniques to ensure the best possible outcomes, prioritizing safety and aesthetics.

Procedure Steps:
Liposuction: Fat is carefully removed from donor areas using advanced liposuction methods to sculpt the body while harvesting viable fat cells.
Purification: The harvested fat is purified to separate healthy fat cells from other materials, ensuring optimal results during the transfer process.
Fat Injection: The purified fat is strategically injected into specific areas of the buttocks to enhance volume, symmetry, and shape. This process ensures a natural, long-lasting result tailored to your desired look.
The procedure typically takes 2-4 hours under general anesthesia. Our surgeons use precise techniques to maximize fat survival rates and minimize risks.

Recovery and Results
Following a BBL at Aesthetic Care Istanbul, patients can expect some swelling and discomfort, which subside within a few weeks. Special care, such as avoiding direct pressure on the buttocks and wearing a compression garment, is essential during the recovery period to ensure optimal fat retention.

Most patients can return to light activities within a week and resume normal routines after 4-6 weeks. The final results become visible over the following months as swelling subsides and the fat cells integrate naturally into the body. The outcome is a more sculpted figure and enhanced buttocks, creating a balanced, attractive silhouette.

Why Choose Aesthetic Care Istanbul for Your BBL?
Aesthetic Care Istanbul is a leading destination for international patients seeking premium cosmetic procedures in Istanbul. Our clinic combines expertise, advanced surgical techniques, and patient-focused care to deliver exceptional results in a safe and comfortable environment.

From your initial consultation to post-surgery care, our team ensures a seamless and supportive experience, helping you achieve the body contour and confidence you desire. Discover the transformative power of a Brazilian Butt Lift at Aesthetic Care Istanbul—where art, science, and patient satisfaction come together for outstanding results.","0981dd59-eec1-46fe-9edf-95b972d3b1c0",2024-11-22T21:19:00Z,2024-11-24T14:38:59Z,"e9f8aded-271b-440f-9e99-b7e6d98e6ce8","/copy-of-implant-detay-kopya/bbl-detail","/copy-of-dental-treatment-detail/bbl-detail"
"Teeth Whitening Detail","Teeth Whitening","Teeth whitening is a cosmetic treatment designed to brighten and lighten stained or discolored teeth. The process typically involves applying a professional whitening gel to the teeth, which is then activated with a special light. This procedure removes surface stains and deeper discoloration, resulting in a whiter, more radiant smile. The treatment is quick, effective, and provides noticeable results.","wix:image://v1/11062b_85cbf868800140b29549e7c6b68c730e~mv2.jpg/Teeth%20Whitening.jpg#originWidth=4997&originHeight=3333","Teeth whitening is a popular and effective cosmetic treatment that brightens and rejuvenates your smile by removing stains and discoloration. At Aesthetic Care Istanbul, we specialize in professional teeth whitening services that restore your teeth to their natural, radiant whiteness, providing noticeable and long-lasting results.

The process begins with a detailed consultation at Aesthetic Care Istanbul, where our experienced dental team assesses your teeth and determines the best whitening method for your needs. We offer both in-office whitening treatments and take-home kits, using advanced whitening technology to achieve optimal results with minimal discomfort.

During the in-office treatment, a professional whitening gel is carefully applied to your teeth, and a special light is used to activate the gel, breaking down stains and discoloration. The procedure is quick, comfortable, and typically takes around 45 minutes to an hour, depending on the level of whitening desired. You’ll leave with visibly brighter, whiter teeth, enhancing your smile and boosting your confidence.

At Aesthetic Care Istanbul, we use the latest whitening techniques and high-quality products to ensure your teeth look naturally bright without causing sensitivity. Whether you have surface stains from food, beverages, or smoking, or deeper discoloration, our team will tailor the treatment to meet your specific needs.

Choose Aesthetic Care Istanbul for professional teeth whitening in Turkey and enjoy a brighter, more youthful smile. With our expert care, advanced technology, and affordable pricing, we help you achieve a smile that dazzles.","0ef47c1a-a0c3-4d89-9217-7e1457f6eef1",2024-11-22T21:06:34Z,2024-11-22T21:09:53Z,"e9f8aded-271b-440f-9e99-b7e6d98e6ce8","/copy-of-implant-detay-kopya/teeth-whitening-detail","/copy-of-dental-treatment-detail/teeth-whitening-detail"
"Facelift Surgery Detail","Facelift Surgery","Facelift surgery, also known as rhytidectomy, is a procedure designed to reduce the visible signs of aging by lifting and tightening the skin on the face and neck. This surgery targets sagging skin, deep wrinkles, and loss of facial volume, offering a more youthful and refreshed appearance. The procedure involves making discreet incisions around the hairline and ears, allowing the surgeon to lift the skin, tighten underlying muscles, and remove excess fat. Facelift surgery is typically performed under general anesthesia, and recovery time ranges from a few weeks to a few months, depending on the individual. The result is smoother, firmer skin with a natural, rejuvenated look.","wix:image://v1/e9f8ad_694d258135d84e1b9d08608e7138a66d~mv2.jpg/Before-After%20(7).jpg#originWidth=1080&originHeight=1080","Facelift surgery, also known as rhytidectomy, is one of the most effective procedures to address the signs of aging, such as sagging skin, deep wrinkles, and loss of facial volume. By lifting and tightening the skin, a facelift can restore a more youthful, refreshed appearance, enhancing both the face and neck. At Aesthetic Care Istanbul, we specialize in delivering high-quality facelift surgery, offering our patients natural-looking results that rejuvenate their facial aesthetics with minimal downtime.

The journey to a rejuvenated appearance begins with a comprehensive consultation at Aesthetic Care Istanbul. Our experienced surgeons carefully assess your facial structure, skin condition, and aesthetic goals, developing a personalized treatment plan tailored to your specific needs. Whether you're seeking to address sagging cheeks, deep creases around the mouth, or a loss of jawline definition, our team at Aesthetic Care Istanbul will guide you through the process to ensure the best possible outcome.

Our expert surgeons use advanced techniques, ensuring minimal scarring, faster healing, and a more natural-looking result. At Aesthetic Care Istanbul, we prioritize patient comfort and safety, performing the procedure under general anesthesia in our state-of-the-art facilities. We also offer post-surgery care to ensure a smooth recovery process, helping you achieve optimal results while minimizing any discomfort or complications.

Following a facelift, most patients experience mild swelling and bruising, which usually subside within a couple of weeks. Most individuals can resume normal activities after 10-14 days, though complete recovery and final results may take several months as the swelling gradually diminishes. The results of a facelift at Aesthetic Care Istanbul can last for many years, with patients enjoying a smoother, tighter, and more youthful appearance.

Choosing Aesthetic Care Istanbul for your facelift surgery means entrusting your care to skilled professionals committed to providing you with exceptional results. Our clinic combines advanced surgical techniques, personalized care, and a dedicated team to deliver one of the best facelift experiences in Istanbul, Turkey. Whether you're looking to turn back the clock or simply enhance your facial aesthetics, Aesthetic Care Istanbul offers expert care and transformative results to help you look and feel your best.","11403192-7f7a-46c7-818e-3632cb84d021",2024-11-22T21:39:28Z,2024-11-24T15:41:06Z,"e9f8aded-271b-440f-9e99-b7e6d98e6ce8","/copy-of-implant-detay-kopya/facelift-surgery-detail","/copy-of-dental-treatment-detail/facelift-surgery-detail"
"Hollywood smile Detail","Hollywood Smile","A Hollywood smile is a cosmetic treatment designed to enhance the appearance of your teeth, giving you a bright, flawless, and symmetrical smile. The process typically involves a combination of teeth whitening, veneers, and crowns to correct imperfections such as discoloration, gaps, and misalignment. The treatment is customized to your facial features and dental needs, resulting in a radiant, confident smile.","wix:image://v1/423bf12ac96b47f5a70c0ddc9abed009.jpg/M%C3%BCkemmel%20g%C3%BCl%C3%BC%C5%9F.jpg#originWidth=5616&originHeight=3744","A Hollywood Smile is the ultimate transformation for anyone looking to achieve a perfect, radiant, and flawless smile. At Aesthetic Care Istanbul, we specialize in creating dazzling Hollywood Smiles, combining advanced dental techniques with a personalized approach to give you a smile that’s not only beautiful but also perfectly suited to your facial features.

What is a Hollywood Smile?
A Hollywood Smile refers to a smile that is bright, even, and perfectly aligned, often seen on celebrities. This transformation involves a combination of aesthetic dental treatments to enhance the overall appearance of your teeth. The goal is to create a natural, yet stunning smile that enhances your facial aesthetics, boosts your confidence, and makes you feel your best.

Hollywood Smile Process at Aesthetic Care Istanbul

At Aesthetic Care Istanbul, we understand that every smile is unique, and we tailor the Hollywood Smile process to suit your specific needs and goals. Our team of experienced dental specialists will work closely with you to develop a customized treatment plan to achieve your dream smile.

Key Components of a Hollywood Smile:
Teeth Whitening: One of the first steps to a Hollywood Smile is achieving a bright, white smile. We offer professional teeth whitening treatments to remove stains and brighten your teeth, creating a radiant base for your smile makeover.
Dental Veneers: Thin, custom-made shells that are placed over your natural teeth to correct imperfections like chips, cracks, or discoloration. Veneers can also help to reshape uneven or misshapen teeth for a flawless appearance.
Zirconium Crown: In cases where teeth are significantly damaged or weakened, crowns can be used to restore strength and appearance. These crowns are designed to blend seamlessly with the natural teeth and enhance the overall smile.
Gum Aesthetics: Sometimes, the appearance of the gums can affect the beauty of a smile. We offer gum contouring treatments to reshape the gums, ensuring a balanced and harmonious smile.

The Hollywood Smile Procedure at Aesthetic Care Istanbul
The process typically begins with a thorough consultation and a digital smile design to envision the final outcome. We will take precise measurements, assess your facial features, and discuss your goals to create a plan that works best for you.

The procedure can take anywhere from a few visits to a couple of weeks, depending on the complexity of the treatments involved. We offer minimally invasive techniques to ensure comfort, and each procedure is performed with the utmost attention to detail, ensuring the best results.

Recovery and Results
One of the great benefits of a Hollywood Smile is that recovery times are typically short. With our advanced techniques, many of the treatments require little downtime. You may experience slight discomfort or sensitivity immediately after the procedure, but this will subside within a few days.

Once your treatment is complete, you’ll have a radiant, symmetrical smile that boosts your confidence and enhances your overall appearance. With proper care and regular dental checkups, your Hollywood Smile can last for years, giving you a beautiful, long-lasting result.

Why Choose Aesthetic Care Istanbul for Your Hollywood Smile?
Aesthetic Care Istanbul is recognized as one of Istanbul’s top dental clinics for cosmetic procedures, specializing in smile makeovers that transform your smile and boost your confidence. Our clinic combines state-of-the-art technology with highly skilled dental professionals to provide world-class care.

Our team of experts is dedicated to ensuring that each patient receives personalized care and attention throughout the entire process. We prioritize patient comfort and safety, using the latest techniques to provide natural-looking, aesthetically pleasing results.

If you are ready to achieve the perfect Hollywood Smile, Aesthetic Care Istanbul is here to help you every step of the way. Book your consultation today and start your journey to a flawless smile that lights up the room.","18cd07bc-c9c2-403d-a4a6-529439e77cd7",2024-11-22T21:09:55Z,2024-11-24T14:29:28Z,"e9f8aded-271b-440f-9e99-b7e6d98e6ce8","/copy-of-implant-detay-kopya/holywood-smile-detail","/copy-of-dental-treatment-detail/hollywood-smile-detail"
"Neck Lift Detail","Neck Lift","A neck lift is a cosmetic procedure designed to remove excess skin and fat from the neck area, while tightening the underlying muscles to create a smoother, more youthful appearance. The surgery typically involves small incisions behind the ears and under the chin, through which the surgeon removes fat and tightens the skin and muscles. Performed under local anesthesia or sedation, the procedure usually takes 1-2 hours. Recovery time is relatively short, with most patients returning to normal activities within a week. Results reveal a more defined jawline and a youthful, rejuvenated neck.","wix:image://v1/e9f8ad_52f2a8c721984e689fc4554402b4ea8b~mv2.jpg/Neck%20Lifting.jpg#originWidth=1080&originHeight=1080","A neck lift, or lower rhytidectomy, is a transformative cosmetic procedure designed to rejuvenate the neck by eliminating excess skin and fat, tightening underlying muscles, and creating a smoother, firmer, and more youthful appearance. Over time, aging, weight fluctuations, and environmental factors can cause the neck to lose its definition, resulting in sagging skin, wrinkles, or a ""turkey wattle"" appearance. At Aesthetic Care Istanbul, our expert surgeons specialize in neck lift procedures, helping patients restore a sleek and contoured neck profile with natural-looking results.

The Neck Lift Process at Aesthetic Care Istanbul
At Aesthetic Care Istanbul, your journey begins with a personalized consultation where our skilled surgeons assess your neck's condition and discuss your goals. We use a tailored approach, ensuring the procedure aligns with your unique facial anatomy and desired outcome. Whether you are addressing sagging skin, stubborn fat deposits, or weakened neck muscles, our team creates a customized treatment plan to achieve the best results.

Performed under local anesthesia with sedation or general anesthesia, a neck lift generally takes 2-3 hours to complete. The advanced techniques used at Aesthetic Care Istanbul ensure minimal scarring, as the incisions are strategically placed to remain hidden within natural contours.

Recovery and Results
After your neck lift at Aesthetic Care Istanbul, you can expect some swelling and mild discomfort, which typically subside within the first week. Patients are usually able to resume light activities after 5-7 days, though full recovery may take a few weeks. Our team provides detailed aftercare instructions to ensure a smooth and comfortable healing process.

As swelling reduces, the results become more apparent, revealing a beautifully contoured and youthful neck. This procedure not only enhances your neck’s appearance but also improves the overall harmony of your face, boosting your confidence and rejuvenating your profile.

Why Choose Aesthetic Care Istanbul?
At Aesthetic Care Istanbul, we combine years of expertise, cutting-edge technology, and a commitment to patient satisfaction to deliver exceptional results. Our clinic is renowned for providing top-tier care to international patients seeking advanced aesthetic procedures in Istanbul.

We prioritize your comfort and safety throughout your journey, from the initial consultation to the recovery process. By choosing Aesthetic Care Istanbul for your neck lift, you can expect a seamless experience, personalized care, and results that enhance your natural beauty.

Rediscover a youthful and defined neck with a neck lift procedure at Aesthetic Care Istanbul—where advanced techniques meet unparalleled expertise for a truly transformative experience.","1df28bd0-8edf-4bad-b980-2871adaaac4d",2024-11-22T21:47:56Z,2024-11-24T16:07:19Z,"e9f8aded-271b-440f-9e99-b7e6d98e6ce8","/copy-of-implant-detay-kopya/neck-lift-detail","/copy-of-dental-treatment-detail/neck-lift-detail"
"Botox Detail","Botox","Botox is a non-surgical cosmetic treatment used to reduce fine lines and wrinkles by temporarily relaxing facial muscles. The procedure involves injecting small amounts of botulinum toxin into targeted areas such as the forehead, crow’s feet, or frown lines. Botox is quick, taking only 10-20 minutes, and requires no downtime. Results appear within a few days, leaving the skin smoother and refreshed, with effects lasting 6 months.","wix:image://v1/e9f8ad_721689436cdd4600a399d6e0e20f1425~mv2.jpg/6.jpg#originWidth=1080&originHeight=1080","Botox, one of the most popular non-surgical cosmetic treatments worldwide, is a safe and effective way to reduce wrinkles and fine lines, restoring a youthful, refreshed appearance. At Aesthetic Care Istanbul, we specialize in advanced Botox applications that deliver natural, long-lasting results. Whether you're looking to smooth forehead lines, soften crow’s feet, or prevent the signs of aging, our expert team provides personalized care in a state-of-the-art facility.

What is Botox?
Botox is a purified form of botulinum toxin type A, designed to relax specific facial muscles temporarily. This reduces the appearance of dynamic wrinkles caused by repetitive facial expressions, such as frowning, smiling, or squinting. Common areas treated with Botox include:

Forehead lines
Frown lines (between the eyebrows)
Crow’s feet (around the eyes)
Bunny lines (on the nose)
Neck bands
In addition to its cosmetic applications, Botox is also used to address medical concerns such as excessive sweating (hyperhidrosis), migraines, and muscle spasms.

The Botox Procedure at Aesthetic Care Istanbul
At Aesthetic Care Istanbul, we prioritize your safety, comfort, and satisfaction. The process begins with a comprehensive consultation, during which our skilled specialists assess your facial anatomy and discuss your aesthetic goals. This ensures a customized treatment plan tailored to your unique needs.

The Botox procedure itself is quick and minimally invasive:
Preparation: The targeted areas are cleansed, and a topical numbing cream may be applied for additional comfort.
Injection: Using ultra-fine needles, our experts administer precise amounts of Botox into specific muscles. The injections are virtually painless and completed in about 10-20 minutes.
Post-Treatment Care: You can resume normal activities immediately, with minimal precautions such as avoiding strenuous exercise or massaging the treated areas for the first 24 hours.

Results and Recovery
Botox starts working within 3-5 days, with full effects visible after 7-10 days. The treated areas appear smoother, while your natural expressions are preserved. The results typically last 6 months, and regular maintenance treatments can prolong the benefits.

Since Botox is a non-surgical procedure, there is no downtime, making it a convenient option for those with busy schedules. Any minor redness or swelling at the injection site subsides quickly, allowing you to return to your daily activities almost immediately.

Why Choose Aesthetic Care Istanbul for Botox?
At Aesthetic Care Istanbul, we combine medical expertise with artistic precision to ensure outstanding results. Our clinic is trusted by patients worldwide for its commitment to excellence, advanced techniques, and patient-focused care. 

When you choose us for your Botox treatment, you benefit from:
Highly trained and experienced specialists
Customized treatment plans tailored to your facial structure
State-of-the-art equipment and premium-quality products
A welcoming and professional environment in the heart of Istanbul

Enhance Your Confidence with Botox
Botox is a simple yet transformative treatment that can help you look and feel your best without surgery. Whether you're addressing fine lines for the first time or maintaining a youthful appearance, Aesthetic Care Istanbul is here to guide you every step of the way.

Discover the benefits of expertly administered Botox at Aesthetic Care Istanbul, where beauty meets expertise. Let us help you achieve smooth, youthful skin and renewed confidence with this safe, effective treatment.","2231e443-e0bc-4a5d-af6f-dcfeb3bc0af6",2024-11-22T21:52:05Z,2024-11-24T15:49:44Z,"e9f8aded-271b-440f-9e99-b7e6d98e6ce8","/copy-of-implant-detay-kopya/botox-detail","/copy-of-dental-treatment-detail/botox-detail"
